firm,ethnicity,cntry,eth_div,cntry_div
AMKR,"korean, korean, vietnamese, english, english, english, european, indian, indian, english, english, chinese, chinese, chinese, chinese, japanese, korean, vietnamese, chinese, chinese, chinese, chinese, chinese, hispanic, korean, korean, korean, korean, chinese, chinese, chinese, chinese, chinese, chinese, chinese, chinese, chinese, chinese, english, hispanic, japanese, japanese, korean, russian, vietnamese, vietnamese, english, english, korean, korean, korean, english, chinese, chinese, japanese, korean, other, english, hispanic, hispanic, english, indian, indian, korean, english, english, english, japanese, other, english, english, english, chinese, chinese, chinese, chinese, chinese, hispanic, korean, korean, korean, korean, japanese, korean, chinese, korean, korean, korean, japanese, korean, korean, vietnamese, english, english, english, chinese, chinese, chinese, chinese, chinese, japanese, korean, korean, korean, korean, korean, chinese, korean, korean, korean, vietnamese, korean, english, chinese, english, japanese, chinese, korean, korean, korean, vietnamese, chinese, english, hispanic, japanese, chinese, english, japanese, chinese, chinese, chinese, chinese, chinese, japanese, korean, korean, korean, korean, korean, hispanic, english, chinese, chinese, chinese, korean, korean, korean, korean, english, chinese, chinese, chinese, chinese, chinese, hispanic, korean, korean, korean, korean, korean, english, english, english, english, other, english, english, english, english, english, european, japanese, korean, korean, vietnamese, english, chinese, indian, korean, korean, korean, chinese, chinese, chinese, chinese, chinese, chinese, korean, korean, korean, korean, vietnamese, vietnamese, english, english, chinese, chinese, chinese, chinese, chinese, chinese, chinese, chinese, english, indian, korean, korean, korean, korean, korean, korean, english, korean, vietnamese, vietnamese, english, chinese, chinese, chinese, chinese, japanese, korean, vietnamese, chinese, chinese, chinese, chinese, english, korean, korean, hispanic, english, english, english, english, european, japanese, chinese, chinese, chinese, chinese, chinese, japanese, korean, korean, korean, korean, korean, english, english, korean, english, korean, other, english, hispanic, english, hispanic, other, korean, chinese, chinese, chinese, chinese, chinese, chinese, korean, korean, korean, korean, vietnamese, vietnamese, english, english, chinese, indian, korean, korean, korean, english, english, chinese, chinese, chinese, chinese, chinese, chinese, chinese, chinese, chinese, chinese, english, hispanic, japanese, japanese, korean, russian, vietnamese, vietnamese, english, chinese, hispanic, hispanic, hispanic, indian, indian, english, other, european, english, english, chinese, chinese, chinese, chinese, english, korean, korean, other, japanese, chinese, english, japanese, english, english, chinese, chinese, chinese, chinese, chinese, hispanic, korean, korean, korean, korean, english, chinese, chinese, chinese, chinese, chinese, chinese, korean, korean, korean, korean, vietnamese, vietnamese, english, korean, korean, korean, english, hispanic, hispanic, chinese, chinese, chinese, chinese, chinese, hispanic, korean, korean, korean, korean, indian, indian, korean, english, english, korean, korean, english, english, english, english, english, english, chinese, vietnamese, english, chinese, chinese, chinese, chinese, chinese, hispanic, korean, korean, korean, korean, english, chinese, chinese, korean, vietnamese, english, chinese, korean, korean, korean, english, korean, korean, vietnamese, english, english, chinese, chinese, chinese, chinese, japanese, korean, korean, korean, korean, english, korean, other, european, indian, indian, english, english, english, chinese, chinese, chinese, chinese, chinese, japanese, korean, korean, korean, korean, korean, chinese, chinese, chinese, chinese, japanese, korean, korean, korean, korean, english, chinese, korean, korean, korean, vietnamese, english, chinese, chinese, chinese, chinese, japanese, korean, vietnamese, chinese, chinese, chinese, chinese, japanese, korean, vietnamese, chinese, chinese, chinese, chinese, japanese, korean, vietnamese, hispanic, english, european, japanese, korean, korean, vietnamese, korean, english, chinese, chinese, chinese, chinese, chinese, chinese, chinese, chinese, english, indian, korean, korean, korean, korean, korean, korean, english, other, chinese, chinese, chinese, korean, korean, korean, korean, chinese, chinese, chinese, chinese, japanese, korean, vietnamese, japanese, korean, english, chinese, korean, korean, korean, other, other, korean, english, english, european, japanese, english, english, chinese, chinese, chinese, chinese, chinese, chinese, chinese, chinese, english, indian, korean, korean, korean, korean, korean, korean, other, english, english, chinese, chinese, chinese, chinese, japanese, korean, korean, korean, korean, chinese, chinese, chinese, chinese, chinese, japanese, korean, korean, korean, korean, korean, english, other, english, european, japanese, korean, korean, vietnamese, korean, chinese, chinese, chinese, chinese, chinese, chinese, chinese, chinese, chinese, chinese, english, hispanic, japanese, japanese, korean, russian, vietnamese, vietnamese, other, english, english, chinese, chinese, chinese, chinese, chinese, japanese, korean, korean, korean, korean, korean, chinese, chinese, chinese, korean, korean, korean, korean, other, chinese, vietnamese, vietnamese, vietnamese","KR, US, US, US, US, US, US, US, SG, KR, US, US, KR, US, TW, PH, US, US, KR, US, US, US, JP, PH, US, US, US, KR, KR, KR, PH, US, US, US, TH, KR, KR, US, US, SG, TW, US, US, US, KR, KR, US, US, SG, US, KR, SG, US, US, US, US, PH, US, US, US, US, KR, US, KR, KR, US, US, KR, US, KR, US, KR, KR, US, US, US, PH, KR, US, US, KR, US, KR, PH, US, US, US, PH, unknown, SG, US, US, KR, US, US, KR, US, TW, US, PH, FR, US, US, KR, PH, JP, KR, US, US, KR, US, KR, US, KR, US, US, KR, KR, US, US, US, SG, US, US, US, US, US, US, TW, US, SG, US, KR, US, KR, US, KR, US, US, KR, US, KR, PH, US, US, US, US, US, KR, US, KR, US, KR, KR, TW, PH, KR, KR, US, KR, US, PH, KR, US, KR, US, KR, PH, PH, US, PH, US, US, TW, PH, US, US, KR, KR, US, PH, KR, KR, TW, PH, US, TW, SG, PH, TW",0.771786892195,0.647756232687
ANAD,"chinese, indian, korean, korean, korean, chinese, chinese, chinese, chinese, chinese, chinese, korean, korean, korean, korean, vietnamese, vietnamese, english, english, chinese, indian, japanese, vietnamese, vietnamese, vietnamese, vietnamese, vietnamese, vietnamese, vietnamese, vietnamese, english, english, indian, english, english, english, english, chinese, english, japanese, chinese, chinese, chinese, chinese, chinese, japanese, korean, korean, korean, korean, korean, english, english, english, chinese, indian, japanese, vietnamese, vietnamese, vietnamese, vietnamese, vietnamese, vietnamese, vietnamese, vietnamese, chinese, chinese, chinese, chinese, chinese, chinese, chinese, chinese, chinese, chinese, english, hispanic, japanese, japanese, korean, russian, vietnamese, vietnamese, english, hispanic, english, english, english, korean, english, english, english, european, hispanic, indian, indian, english, english, indian, european, english, english, english, european, english, english, english, indian, chinese, chinese, chinese, chinese, chinese, japanese, korean, korean, korean, korean, korean, chinese, chinese, japanese, korean, english, english, english, chinese, chinese, chinese, chinese, chinese, hispanic, korean, korean, korean, korean","US, US, US, US, US, US, US, US, US, US, US, US, US, US, US, US, US, US, US, US, US, unknown, US, US, US, US, US, US, US, US, US, US, US, US, US, US, US, US, US, US, US",0.816825259516,0.093991671624
ATML,"english, korean","AU, unknown",0.5,0.5
ATNY,"english, japanese, chinese, vietnamese, english, english, english, chinese, chinese, chinese, chinese, chinese, chinese, chinese, japanese, russian, vietnamese, vietnamese, korean, japanese, english, english, english, indian, russian, english, english, english, japanese, japanese, english, english, english, japanese, japanese","CH, JP, CH, US, GB, US, JP, unknown, JP, US, GB, GB, US, JP, JP, US, GB, US, JP, JP",0.777142857143,0.74
AXTI,"chinese, chinese, chinese, english, vietnamese, chinese, chinese, chinese, chinese, chinese, japanese, korean, korean, korean, korean, korean, chinese, chinese, chinese, chinese, chinese, chinese, chinese, chinese, chinese, chinese, english, hispanic, japanese, japanese, korean, russian, vietnamese, vietnamese, english, chinese, chinese, chinese, chinese, chinese, japanese, korean, korean, korean, korean, korean, chinese, chinese, chinese, chinese, chinese, chinese, chinese, chinese, chinese, chinese, english, hispanic, japanese, japanese, korean, russian, vietnamese, vietnamese, english, english, indian, chinese, chinese, chinese, chinese, chinese, chinese, chinese, chinese, english, indian, korean, korean, korean, korean, korean, korean, chinese, chinese, chinese, chinese, chinese, chinese, chinese, japanese, russian, vietnamese, vietnamese, korean, chinese, chinese, chinese, chinese, chinese, korean, korean, korean, korean, chinese, chinese, chinese, japanese, korean","US, US, US, US, US, US, US, US, US, unknown, US, US, US",0.681760794546,0.272189349112
