firm,ethnicity,cntry,eth_div,cntry_div
AAOI,"chinese, chinese, chinese, vietnamese, english, chinese, korean, chinese, chinese, japanese, korean, english, english, english, english, english, korean, english, english, english, english, european, japanese, chinese, chinese, chinese, chinese, english, korean, korean, english, chinese, chinese, japanese, korean, chinese, chinese, chinese, chinese, japanese, korean, english, english, chinese, chinese, chinese, chinese, chinese, chinese, chinese, chinese, chinese, chinese, english, hispanic, japanese, japanese, korean, russian, vietnamese, vietnamese, chinese, chinese, chinese, japanese, korean, chinese, chinese, chinese, japanese, korean","US, US, US, US, US, US, US, US, US, unknown, US, US, US, US, US, US, US, US, US, US, US, US",0.729617139456,0.169421487603
ADI,"european, korean, english, english, english, english, english, english, european, russian, vietnamese, english, english, english, english, chinese, chinese, chinese, chinese, japanese, korean, korean, korean, korean, english, english, english, european, russian, english, english, other, english, english, chinese, chinese, chinese, chinese, chinese, japanese, korean, korean, korean, korean, korean, english, english, english, english, english, japanese, english, english, indian, indian, english, english, english, english, english, english, european, hispanic, hispanic, english, english, japanese, english, english, english, english, european, english, english, english, english, english, english, european, english, english, english, chinese, chinese, chinese, chinese, chinese, chinese, korean, korean, korean, korean, vietnamese, vietnamese, english, english, english, english, hispanic, vietnamese, indian, korean, korean, english, english, english, european, european, japanese, indian, english, european, hispanic, english, chinese, vietnamese, english, english, english, english, english, hispanic, english, english, english, english, english, english, russian, vietnamese, vietnamese, vietnamese, english, chinese, chinese, chinese, english, vietnamese, english, other, english, hispanic, english, english, english, english, english, english, chinese, chinese, chinese, chinese, japanese, korean, vietnamese, english, english, english, english, english, english, english, hispanic, english, english, english, english, english, chinese, chinese, chinese, chinese, chinese, hispanic, korean, korean, korean, korean, english, english, english, chinese, chinese, chinese, chinese, chinese, chinese, chinese, chinese, chinese, chinese, english, hispanic, japanese, japanese, korean, russian, vietnamese, vietnamese, english, english, european, japanese, english, vietnamese, european, english, english, english, english, english, russian, chinese, vietnamese, english, european, hispanic, english, english, european, russian, vietnamese, english, english, english, english, indian, russian, english, english, english, european, english, russian, english, chinese, chinese, korean, vietnamese, english, english, english, english, english, english, english, chinese, indian, korean, korean, korean, japanese, english, other, chinese, chinese, chinese, chinese, japanese, korean, vietnamese, english, english, indian, russian, english, russian, english, english, english, english, english, european, english, european, european, english, indian, european, chinese, other, english, hispanic, english, english, european, japanese, chinese, chinese, chinese, chinese, chinese, chinese, chinese, japanese, russian, vietnamese, vietnamese, english, english, indian, russian, english, european, chinese, english, japanese, korean, english, english, english, english, english, english, english, european, english, english, english, english, english, european, english, english, english, english, english, english, english, english, english, english, japanese, english, english, english, english, chinese, vietnamese, english, english, english, european, european, english, english, english, english, english, european, japanese, english, english, english, english, other, english, english, english, english, english, english, english, english, european, english, english, english, english, english, english, english, indian, chinese, chinese, chinese, chinese, japanese, korean, vietnamese, english, hispanic, english, english, european, chinese, chinese, chinese, chinese, chinese, chinese, chinese, chinese, chinese, chinese, english, hispanic, japanese, japanese, korean, russian, vietnamese, vietnamese, english, english, english, english, korean, korean, vietnamese, english, hispanic, hispanic, english, english, english, vietnamese, indian, english, english, english, english, english, chinese, chinese, chinese, english, vietnamese, european, korean, korean, english, english, english, english, english, japanese, korean, korean, vietnamese, english, european, korean, korean, english, english, english, english, english, russian, english, english, english, chinese, chinese, chinese, chinese, chinese, chinese, chinese, chinese, english, indian, korean, korean, korean, korean, korean, korean, english, english, european, european, vietnamese, european, english, english, english, european, korean, korean, english, english, hispanic, english, english, english, english, japanese, indian, korean, korean, chinese, english, english, english, korean, korean, vietnamese, chinese, chinese, chinese, chinese, japanese, korean, vietnamese, english, english, english, indian, english, english, european, hispanic, japanese, english, english, russian, chinese, chinese, chinese, chinese, japanese, korean, vietnamese, english, english, european, korean, english, english, english, english, english, japanese, english, english, indian, english, english, european, english, english, english, english, english, english, english, english, english, english, english, english, chinese, vietnamese, indian, indian, european, english, english, russian, english, english, chinese, chinese, korean, english, english, english, indian, korean, korean, indian, english, chinese, chinese, chinese, chinese, chinese, chinese, chinese, chinese, chinese, chinese, english, hispanic, japanese, japanese, korean, russian, vietnamese, vietnamese, english, english, chinese, chinese, english, english, english, english, english, english, chinese, chinese, chinese, english, vietnamese, english, english, english, english, english, indian, russian, english, chinese, chinese, chinese, english, vietnamese, english, chinese, indian, korean, korean, korean, english, english, english, english, english, english, english, other, english, english, european, english, english, chinese, chinese, chinese, english, vietnamese, english, chinese, chinese, chinese, english, vietnamese, english, english, english, english, english, english, english, chinese, chinese, chinese, chinese, chinese, chinese, chinese, japanese, russian, vietnamese, vietnamese, english, european, english, english, other, european, english, english, english, chinese, chinese, chinese, korean, korean, korean, korean, english, english, english, english, english, chinese, chinese, chinese, japanese, korean, english, english, chinese, english, japanese, english, chinese, hispanic, hispanic, hispanic, indian, indian, english, english, english, russian, vietnamese, hispanic, vietnamese, english, english, european, russian, vietnamese, chinese, chinese, chinese, chinese, chinese, chinese, chinese, chinese, chinese, chinese, english, hispanic, japanese, japanese, korean, russian, vietnamese, vietnamese, english, english, english, english, chinese, chinese, japanese, korean, hispanic, english, english, english, english, english, english, european, european, english, english, english, english, english, other, english, english, english, english, english, other, english, japanese, korean, korean, vietnamese, chinese, english, japanese, english, indian, russian, english, english, english, english, russian, english, japanese, korean, korean, vietnamese, chinese, vietnamese, english, english, english, english, english, hispanic, english, english, european, english, english, english, english, english, european, english, english, english, english, english, english, english, english, english, chinese, chinese, english, chinese, chinese, chinese, chinese, chinese, japanese, korean, korean, korean, korean, korean, english, english, english, english, japanese, indian, english, english, chinese, vietnamese, english, english, english, english, english, english, european, japanese, korean, korean, vietnamese, korean, english, russian, english, english, english, chinese, chinese, chinese, chinese, english, korean, korean, english, chinese, english, japanese, english, english, russian, european, european, japanese, english, european, japanese, korean, korean, vietnamese, english, english, english, english, russian, hispanic, chinese, chinese, chinese, english, vietnamese, japanese, english, english, vietnamese, english, other, chinese, chinese, chinese, chinese, chinese, chinese, chinese, chinese, chinese, chinese, english, hispanic, japanese, japanese, korean, russian, vietnamese, vietnamese, vietnamese, english, vietnamese, vietnamese, vietnamese, english, hispanic, english, english, chinese, chinese, chinese, chinese, chinese, chinese, chinese, chinese, chinese, chinese, english, hispanic, japanese, japanese, korean, russian, vietnamese, vietnamese, vietnamese, english, korean, english, english, english, english, english, russian, english, english, chinese, chinese, korean, english, english, european, european, european, english, english, english, hispanic, english, english, english, english, english, english, english, english, english, english, european, english, english, chinese, chinese, japanese, korean, english, english, chinese, korean, hispanic, english, english, indian, indian, english, english","US, US, US, US, US, US, IE, US, IE, US, US, US, US, IE, US, US, GB, US, IR, US, IE, US, IE, US, IE, US, US, US, IN, IN, US, US, US, US, US, IE, GB, US, US, US, US, IE, US, US, DK, US, IE, US, US, GB, IE, DK, US, US, IE, US, US, US, US, US, US, US, US, US, US, US, US, US, US, US, US, US, US, US, US, IE, GB, US, US, US, US, IE, GB, IE, IE, US, US, IE, IL, US, US, US, IE, US, US, US, GB, US, GB, US, US, IE, US, US, GB, GB, US, US, US, US, US, IE, US, US, US, US, US, US, DK, IE, US, US, GB, US, US, US, US, GB, IR, US, US, US, US, US, GB, US, IE, IE, US, US, US, US, US, US, IE, US, US, US, IE, IL, US, IE, US, US, US, US, US, IE, US, US, IE, US, US, US, US, IL, US, US, US, US, US, US, US, US, US, GB, US, US, US, IE, US, IE, US, US, US, US, US, US, IE, GB, US, US, US, US, US, US, IE, US, US, US, US, US, US, IE, US, US, US, US, CA, US, US, US, US, IE, GB, US, IL, US, IE, US, US, US, US, US, US, US, US, US, US, US, IE, CA, US, US, IE, IE, US, IE, IE, US, US, US, US, US, IE, US, IE, US, US, CA, US, IN, US, US, US, IE, US, GB, US, GB, US, US, US, US, US, US, US, US, US, IE, US, US, US, US, US, US, GB, US, US, US, US, DE, US, IE, US, US, unknown, US, US, US, US, GB, US, US, IE, US, US, US, IE, US, IE, US, US, US, US, IN, US, US, US, IE, US, US, US, IE, US, DK, US, US, GB, GB, US, US, US, US, US, US, US, CH, US, US, US, US, US, US, US, US, US, US, IE, GB, US, US, IE, GB, IE, IE, US, IE, GB, IE, US, US, US, US, US, US, US, US, US, GB, IE, US, GB, US, CA, GB, US, US, IE, US, US, US, US, US, US, US, IE, US, US, GB, IL, US, US, DK, US, GB, US, US, GB, IE, IE, GB, US, US, US, GB, US, US, US, US, IL, US, US, US, US, US, US, US, IE, US, US, US, US, IE, US, US, US, US, US, IE, IE, US, US, US, US, US, IE, US, US, US, US, US, US, US, US, US, US, US, US, IE, IE, US, IL, US, US, US, US, US, IL, US, IE, US, US, US, US, US, US, IE, US, US, US, US, IE, IE, US, US, US, CA, IE, US, US, US, US, US, GB, DK, IE, US, US, US, US, IE, US, US, US, US, US, US, US, IE, US, US, US, IN, US, IE, US, IE, US, US, IE, IE, US, US, GB, US, IE, US, US, US, US, US, IE, IE, US, US, US, US, US, US, US, IE, US, JP, US, US, IE, US, IL, US, US, IE, IE, IE, IE, US, US, US, US, IE, US, IE, US, US, US, IE, US, US, US, US, IE, US, US, US, US, US, US, US, US, IE, US, IE, US, IE, US, US, US, US, IE, US, US, US, US, US, IE, US, US, IN, IE, US",0.736015278273,0.455493460166
AFOP,"chinese, chinese, japanese, korean, chinese, chinese, chinese, chinese, japanese, korean, vietnamese, chinese, chinese, chinese, chinese, chinese, chinese, chinese, chinese, chinese, chinese, chinese, chinese, english, hispanic, japanese, japanese, korean, russian, vietnamese, vietnamese, chinese, chinese, chinese, chinese, english, korean, korean, chinese, chinese, chinese, chinese, english, korean, korean, european, european, chinese, chinese, chinese, chinese, english, korean, korean, korean, chinese, hispanic, hispanic, hispanic, indian, indian, chinese, chinese, chinese, chinese, chinese, chinese, chinese, chinese, chinese, chinese, english, hispanic, japanese, japanese, korean, russian, vietnamese, vietnamese, english, chinese, chinese, chinese, chinese, chinese, japanese, korean, korean, korean, korean, korean, chinese, chinese, chinese, chinese, chinese, chinese, chinese, chinese, chinese, chinese, english, hispanic, japanese, japanese, korean, russian, vietnamese, vietnamese, chinese, chinese, chinese, chinese, chinese, chinese, chinese, chinese, chinese, chinese, english, hispanic, japanese, japanese, korean, russian, vietnamese, vietnamese, chinese, korean, korean, korean, vietnamese, chinese, chinese, chinese, chinese, chinese, chinese, chinese, chinese, chinese, chinese, english, hispanic, japanese, japanese, korean, russian, vietnamese, vietnamese, chinese, hispanic, hispanic, hispanic, indian, indian, chinese, chinese, japanese, korean, korean, chinese, chinese, chinese, chinese, chinese, hispanic, korean, korean, korean, korean, chinese, chinese, chinese, japanese, korean, chinese, chinese, chinese, chinese, chinese, chinese, chinese, chinese, chinese, chinese, english, hispanic, japanese, japanese, korean, russian, vietnamese, vietnamese, english, hispanic, vietnamese, chinese, chinese, chinese, chinese, japanese, korean, korean, korean, korean, chinese, chinese, chinese, chinese, chinese, chinese, chinese, japanese, korean, korean, korean, korean, korean, chinese, chinese, chinese, chinese, chinese, chinese, english, korean, korean, chinese, chinese, chinese, chinese, chinese, hispanic, korean, korean, korean, korean, chinese, chinese, chinese, chinese, chinese, chinese, chinese, chinese, chinese, chinese, english, hispanic, japanese, japanese, korean, russian, vietnamese, vietnamese, english, european, japanese, korean, korean, vietnamese, chinese, chinese, chinese, chinese, chinese, chinese, chinese, chinese, chinese, chinese, english, hispanic, japanese, japanese, korean, russian, vietnamese, vietnamese, chinese, chinese, korean, vietnamese, chinese, chinese, chinese, chinese, chinese, chinese, chinese, chinese, english, indian, korean, korean, korean, korean, korean, korean, chinese, chinese, chinese, chinese, chinese, chinese, chinese, chinese, chinese, chinese, english, hispanic, japanese, japanese, korean, russian, vietnamese, vietnamese, chinese, chinese, chinese, chinese, english, korean, korean, chinese, chinese, chinese, chinese, english, korean, korean, chinese, chinese, japanese, korean","US, US, US, US, TW, TW, US, US, US, US, US, US, US, US, US, US, TW, US, US, unknown, TW, US, US, US, US, US, US, US, US, US, US, US, TW, US, TW, US, US, TW, TW, TW",0.694727891156,0.4225
ALTR,"chinese, chinese, chinese, chinese, chinese, chinese, chinese, chinese, chinese, chinese, english, hispanic, japanese, japanese, korean, russian, vietnamese, vietnamese, chinese, hispanic, korean, korean, english, english, hispanic, english, chinese, chinese, japanese, korean, english, english, english, chinese, korean, japanese, english, english, chinese, chinese, chinese, chinese, japanese, korean, english, english, european, english, english, english, english, european, korean, hispanic, indian, indian, chinese, chinese, chinese, english, vietnamese, english, english, indian, english, english, chinese, chinese, chinese, chinese, english, korean, korean, english, english, chinese, chinese, chinese, japanese, chinese, chinese, chinese, chinese, chinese, chinese, chinese, chinese, chinese, chinese, english, hispanic, japanese, japanese, korean, russian, vietnamese, vietnamese, english, english, english, european, japanese, english, hispanic, hispanic, english, english, english, chinese, chinese, korean, vietnamese, english, english, chinese, chinese, chinese, chinese, chinese, chinese, chinese, chinese, english, indian, korean, korean, korean, korean, korean, korean, english, hispanic, chinese, chinese, chinese, chinese, chinese, chinese, chinese, chinese, chinese, chinese, english, hispanic, japanese, japanese, korean, russian, vietnamese, vietnamese, chinese, chinese, chinese, chinese, chinese, chinese, chinese, chinese, chinese, chinese, english, hispanic, japanese, japanese, korean, russian, vietnamese, vietnamese, indian, indian, korean, english, english, hispanic, indian, indian, english, english, chinese, chinese, chinese, english, vietnamese, english, english, english, japanese, chinese, vietnamese, vietnamese, vietnamese, hispanic, chinese, chinese, chinese, chinese, chinese, chinese, chinese, chinese, chinese, chinese, english, hispanic, japanese, japanese, korean, russian, vietnamese, vietnamese, chinese, vietnamese, korean, vietnamese, vietnamese, english, english, indian, english, vietnamese, vietnamese, vietnamese, english, chinese, vietnamese, english, english, vietnamese, english, english, english, chinese, chinese, korean, korean, chinese, chinese, chinese, chinese, japanese, korean, vietnamese, english, english, english, hispanic, english, english, english, english, english, indian, english, english, english, english, chinese, chinese, chinese, chinese, chinese, chinese, chinese, chinese, chinese, chinese, english, hispanic, japanese, japanese, korean, russian, vietnamese, vietnamese, chinese, english, indian, chinese, english, japanese, english, european, english, english, indian, english, english, english, english, english, english, english, english, english, english, english, english, english, english, english, chinese, chinese, chinese, chinese, chinese, japanese, korean, korean, korean, korean, korean, indian, english, chinese, chinese, chinese, chinese, chinese, japanese, korean, korean, korean, korean, korean, english, english, english, english, chinese, chinese, chinese, chinese, chinese, japanese, korean, korean, korean, korean, korean, english, english, english, english, english, english, english, russian, chinese, korean, korean, korean, vietnamese, chinese, indian, indian, english, chinese, chinese, korean, vietnamese, english, english, english, chinese, chinese, chinese, chinese, chinese, chinese, chinese, chinese, chinese, chinese, english, hispanic, japanese, japanese, korean, russian, vietnamese, vietnamese, english, hispanic, hispanic, chinese, chinese, chinese, chinese, chinese, chinese, chinese, chinese, chinese, chinese, chinese, chinese, english, hispanic, japanese, japanese, korean, russian, vietnamese, vietnamese, korean, hispanic, vietnamese, english, english, english, hispanic, indian, indian, english, chinese, vietnamese, vietnamese, vietnamese, english, indian, indian, english, chinese, indian, korean, korean, korean, chinese, hispanic, korean, korean, english, english, chinese, chinese, chinese, chinese, chinese, chinese, chinese, chinese, chinese, chinese, english, hispanic, japanese, japanese, korean, russian, vietnamese, vietnamese, chinese, chinese, japanese, korean, english, english, european, japanese, chinese, chinese, chinese, chinese, chinese, chinese, chinese, chinese, chinese, chinese, english, hispanic, japanese, japanese, korean, russian, vietnamese, vietnamese, english, english, english, english, chinese, chinese, chinese, chinese, chinese, japanese, korean, korean, korean, korean, korean, english, korean, english, chinese, chinese, japanese, korean, english, chinese, chinese, chinese, english, vietnamese, indian, indian, korean, english, chinese, chinese, chinese, chinese, chinese, chinese, chinese, chinese, english, indian, korean, korean, korean, korean, korean, korean, english, chinese, vietnamese, vietnamese, english, english, english, indian, english, chinese, chinese, chinese, chinese, chinese, chinese, chinese, chinese, english, indian, korean, korean, korean, korean, korean, korean, chinese, chinese, chinese, chinese, vietnamese, vietnamese, english, english, english, english, english, chinese, chinese, chinese, chinese, english, korean, korean, english, english, chinese, vietnamese, korean, vietnamese, vietnamese, english, hispanic, hispanic, english, english, english, english, chinese, chinese, chinese, chinese, chinese, chinese, chinese, chinese, chinese, chinese, english, hispanic, japanese, japanese, korean, russian, vietnamese, vietnamese, english, chinese, indian, korean, korean, korean, english, english, english, english, english, english, english, english, english, chinese, chinese, english, chinese, english, english, chinese, vietnamese, vietnamese, english, chinese, japanese, korean, korean, vietnamese, english, english, indian, english, english, english, chinese, chinese, chinese, chinese, chinese, chinese, chinese, chinese, english, indian, korean, korean, korean, korean, korean, korean, european, chinese, chinese, chinese, chinese, english, korean, korean, english, english, english, chinese, chinese, chinese, chinese, chinese, hispanic, korean, korean, korean, korean, chinese, chinese, japanese, korean, chinese, chinese, chinese, chinese, chinese, japanese, korean, korean, korean, korean, korean, english, chinese, chinese, chinese, english, vietnamese, english, english, hispanic, english, indian, english, hispanic, japanese, japanese, japanese, chinese, hispanic, hispanic, hispanic, indian, indian, english, english, english, english, indian, english, english, english, chinese, chinese, korean, vietnamese, english, english, english, english, english, chinese, vietnamese, english, english, english, chinese, chinese, korean, english, european, korean, korean, english, english, english, english, chinese, chinese, chinese, chinese, chinese, chinese, chinese, chinese, chinese, chinese, english, hispanic, japanese, japanese, korean, russian, vietnamese, vietnamese, english, english, english, chinese, indian, japanese, vietnamese, vietnamese, vietnamese, vietnamese, vietnamese, vietnamese, vietnamese, vietnamese, chinese, chinese, chinese, chinese, chinese, japanese, korean, korean, korean, korean, korean, english, vietnamese, english, hispanic, korean, english, english, japanese, korean, korean, vietnamese, english, english, english, chinese, chinese, chinese, english, vietnamese, english, english, english, japanese, japanese, english, english, english, english, chinese, chinese, japanese, korean, chinese, chinese, chinese, chinese, chinese, chinese, chinese, japanese, russian, vietnamese, vietnamese, english, chinese, japanese, korean, english, english, english, english, english, indian, english, russian, english, chinese, chinese, japanese, korean, hispanic, indian, indian, english, english, indian, english, english, english, english, chinese, chinese, chinese, chinese, english, korean, korean, chinese, chinese, chinese, chinese, chinese, japanese, korean, korean, korean, korean, korean, english, english, chinese, chinese, chinese, chinese, english, korean, korean, english, english, chinese, english, japanese, european, indian, indian, chinese, vietnamese, vietnamese, vietnamese, english, english, chinese, chinese, chinese, chinese, chinese, hispanic, korean, korean, korean, korean","US, US, CA, CA, US, US, US, US, GB, US, US, CA, US, US, US, US, US, CA, US, US, GB, US, US, US, US, US, US, GB, US, US, US, US, US, MY, CA, GB, US, US, US, US, US, US, US, US, US, US, US, US, US, US, US, CA, US, US, US, US, US, US, US, US, US, US, GB, US, US, GB, CA, CA, US, US, CA, US, US, US, US, US, MY, US, US, US, US, US, US, US, GB, US, US, US, US, US, US, US, MY, US, US, GB, US, NL, US, US, US, GB, US, US, US, US, US, US, US, US, US, US, US, US, US, US, US, US, CA, US, US, US, US, US, US, US, US, US, US, US, US, MY, CA, US, US, US, US, US, US, US, CA, US, unknown, US, US, US, US, US, US, US, CA, US, US, US, US, CA, US, US, GB, US, US, US, US, US, US, GB, US, US, US, US, US, US, US, US, US, US, CA, US, US, US, CA, US, GB, US, US, US, US, US, US, US, US, GB, US, GB, US, US, US, GB, CA, US, US, CA, US, US, US, US, GB, GB, GB, US, MY, US, US, US, US, MY, GB, US, US, US, US, US, US, MY, NL, US, US, US, US, US, MY, US, US, US, US, US, US, US, US, US, US, US, US, US, US, US, US, US, US, US, US, US, CA, US, US, US, US, US, US, US, US, CA, US, GB, US, CA, US, US, US, US, US, US, US, US, GB, US, US, GB, US, CA, US, US, US, US, US, US, US, US, US, US, CA, US, CA, US, CA, US, CA, US, GB, US, US, CA, US, US, GB, US, US, US, US, US, US, CA, US, CA, GB, CA, US, CA, US, US, US, US, US, US, US",0.782100263904,0.35900591716
