firm,ethnicity,cntry,eth_div,cntry_div
FSL,"english, english, vietnamese, english, english, english, chinese, vietnamese, vietnamese, vietnamese, english, english, chinese, chinese, japanese, korean, english, english, english, english, european, european, english, english, english, english, english, english, english, japanese, english, european, european, english, european, indian, indian, european, european, english, english, english, chinese, chinese, chinese, chinese, chinese, chinese, chinese, chinese, chinese, chinese, english, hispanic, japanese, japanese, korean, russian, vietnamese, vietnamese, english, english, english, english, chinese, chinese, chinese, chinese, english, korean, korean, chinese, chinese, chinese, chinese, chinese, chinese, chinese, chinese, chinese, chinese, english, hispanic, japanese, japanese, korean, russian, vietnamese, vietnamese, english, english, english, chinese, chinese, chinese, chinese, chinese, japanese, korean, korean, korean, korean, korean, english, english, english, chinese, chinese, japanese, korean, european, english, english, english, other, chinese, vietnamese, vietnamese, vietnamese, english, european, english, chinese, indian, korean, korean, korean, indian, english, english, english, english, hispanic, english, english, english, chinese, chinese, chinese, chinese, chinese, chinese, chinese, chinese, chinese, chinese, english, hispanic, japanese, japanese, korean, russian, vietnamese, vietnamese, chinese, chinese, chinese, korean, korean, korean, korean, english, english, chinese, english, japanese, english, indian, english, indian, indian, english, english, european, english, european, hispanic, english, european, english, russian, english, chinese, chinese, korean, vietnamese, english, hispanic, english, english, english, english, european, english, english, english, chinese, chinese, european, european, english, korean, korean, vietnamese, english, english, english, russian, english, english, english, english, english, english, hispanic, chinese, chinese, chinese, chinese, chinese, japanese, korean, korean, korean, korean, korean, chinese, chinese, chinese, chinese, chinese, chinese, korean, korean, korean, korean, vietnamese, vietnamese, english, european, russian, vietnamese, english, english, english, english, english, european, english, chinese, chinese, chinese, chinese, chinese, chinese, chinese, chinese, english, indian, korean, korean, korean, korean, korean, korean, english, english, english, other, chinese, chinese, english, english, chinese, chinese, chinese, chinese, vietnamese, vietnamese, english, english, english, english, english, english, indian, russian, indian, english, english, english, other, english, chinese, chinese, chinese, chinese, chinese, chinese, korean, korean, korean, korean, vietnamese, vietnamese, hispanic, english, english, english, indian, indian, korean, chinese, chinese, chinese, english, european, english, english, english, chinese, chinese, chinese, chinese, chinese, chinese, chinese, chinese, english, indian, korean, korean, korean, korean, korean, korean, english, japanese, japanese, english, english, european, russian, vietnamese, english, chinese, vietnamese, japanese, english, english, english, english, european, indian, english, european, hispanic, hispanic, english, hispanic, hispanic, english, english, hispanic, english, english, english, hispanic, chinese, vietnamese, vietnamese, vietnamese, english, english, english, english, chinese, chinese, chinese, chinese, english, korean, korean, chinese, korean, korean, korean, vietnamese, chinese, chinese, japanese, korean, english, english, indian, english, english, english, english, korean, korean, vietnamese, english, english, english, english, english, english, english, english, european, english, english, english, english, english, chinese, korean, korean, korean, vietnamese, english, european, english, european, indian, indian, european, english, korean, hispanic, european, indian, indian, english, english, english, english, chinese, chinese, korean, vietnamese, english, hispanic, english, japanese, english, english, english, chinese, vietnamese, vietnamese, vietnamese, english, indian, english, vietnamese, european, english, chinese, chinese, chinese, chinese, chinese, japanese, korean, korean, korean, korean, korean, chinese, chinese, chinese, chinese, japanese, korean, korean, korean, korean, japanese, english, english, english, english, european, english, english, english, english, english, english, chinese, chinese, chinese, chinese, vietnamese, vietnamese, english, english, european, english, english, other, chinese, chinese, chinese, chinese, chinese, chinese, chinese, japanese, russian, vietnamese, vietnamese, english, european, english, english, english, english, korean, english, english, indian, english, korean, english, english, european, european, english, chinese, chinese, chinese, chinese, chinese, japanese, korean, korean, korean, korean, korean, chinese, vietnamese, vietnamese, english, chinese, indian, japanese, vietnamese, vietnamese, vietnamese, vietnamese, vietnamese, vietnamese, vietnamese, vietnamese, english, english, english, english, english, english, english, english, european, european, indian, english, english, english, english, chinese, chinese, chinese, chinese, japanese, korean, vietnamese, english, chinese, chinese, chinese, korean, korean, korean, korean, english, english, european, chinese, chinese, chinese, chinese, japanese, korean, vietnamese, english, english, english, english, english, english, english, chinese, hispanic, korean, korean, chinese, chinese, japanese, korean, vietnamese, english, other, english, other, vietnamese, english, english, english, english, english, chinese, chinese, chinese, chinese, english, korean, korean, english, hispanic, chinese, vietnamese, chinese, english, japanese, japanese, japanese, english, english, chinese, chinese, chinese, chinese, chinese, chinese, chinese, chinese, chinese, chinese, english, hispanic, japanese, japanese, korean, russian, vietnamese, vietnamese, english, indian, english, chinese, chinese, chinese, japanese, korean, english, english, indian, english, chinese, vietnamese, vietnamese, vietnamese, english, english, english, english, chinese, chinese, chinese, chinese, chinese, chinese, chinese, chinese, english, indian, korean, korean, korean, korean, korean, korean, hispanic, english, vietnamese, english, chinese, vietnamese, english, hispanic, english, english, english, chinese, chinese, chinese, chinese, chinese, chinese, chinese, chinese, english, indian, korean, korean, korean, korean, korean, korean, english, english, english, russian, english, english, hispanic, english, chinese, chinese, chinese, chinese, chinese, chinese, chinese, chinese, chinese, chinese, english, hispanic, japanese, japanese, korean, russian, vietnamese, vietnamese, hispanic, chinese, chinese, chinese, chinese, chinese, chinese, chinese, chinese, english, indian, korean, korean, korean, korean, korean, korean, chinese, chinese, chinese, chinese, chinese, japanese, korean, korean, korean, korean, korean, english, english, english, chinese, vietnamese, chinese, chinese, japanese, korean, european, chinese, chinese, chinese, chinese, chinese, chinese, chinese, chinese, chinese, chinese, english, hispanic, japanese, japanese, korean, russian, vietnamese, vietnamese, english, english, indian, english, chinese, vietnamese, vietnamese, vietnamese, european, english, indian, english, english, english, other, chinese, chinese, chinese, english, vietnamese, english, english, chinese, chinese, chinese, chinese, chinese, hispanic, korean, korean, korean, korean, chinese, indian, japanese, vietnamese, vietnamese, vietnamese, vietnamese, vietnamese, vietnamese, vietnamese, vietnamese, chinese, chinese, japanese, korean, english, chinese, indian, japanese, vietnamese, vietnamese, vietnamese, vietnamese, vietnamese, vietnamese, vietnamese, vietnamese, english, european, english, english, english, european, english, hispanic, hispanic, english, english, english, english, chinese, chinese, japanese, korean, english, english, english, chinese, chinese, chinese, chinese, japanese, korean, vietnamese, english, english, chinese, chinese, korean, vietnamese, english, english, english, european, english, english, english, english, other, hispanic, japanese, japanese, japanese, english, english, english, english, english, indian, european, english, english, chinese, vietnamese, chinese, chinese, chinese, chinese, english, korean, korean, european, english, english, european, korean, korean, vietnamese, english, english, chinese, chinese, chinese, chinese, chinese, chinese, chinese, chinese, chinese, chinese, english, hispanic, japanese, japanese, korean, russian, vietnamese, vietnamese, english, english, english, english, chinese, chinese, chinese, chinese, chinese, chinese, korean, korean, korean, korean, vietnamese, vietnamese, english, english, english, english, chinese, chinese, chinese, japanese, korean, european, english, european, english, english, english, english, english, english, japanese, english, english, english, english, hispanic, hispanic, chinese, chinese, chinese, chinese, vietnamese, vietnamese, english, english, english, english, english, european, hispanic, english, english, japanese, english, english, english, english, indian, russian, indian, european, japanese, chinese, indian, korean, korean, korean, english, vietnamese, chinese, chinese, chinese, japanese, korean, chinese, indian, korean, korean, korean, english, english, english, english, english, chinese, chinese, chinese, chinese, japanese, korean, vietnamese, english, english, european, indian, english, english, european, english, english, english, english, vietnamese, hispanic, hispanic, european, indian, indian, chinese, chinese, chinese, japanese, japanese, english, chinese, korean, korean, korean, vietnamese, vietnamese, european, european, english, indian, english, english, english, english, other, english, english, hispanic, hispanic, english, english, english, english, hispanic, chinese, chinese, chinese, japanese, korean, english, english, english, chinese, chinese, chinese, chinese, japanese, korean, vietnamese, chinese, korean, korean, korean, vietnamese, english, european, english, indian, indian, korean, chinese, chinese, chinese, chinese, chinese, hispanic, korean, korean, korean, korean, english, hispanic, korean, vietnamese, vietnamese, english, european, english, chinese, chinese, chinese, chinese, chinese, chinese, korean, korean, korean, korean, vietnamese, vietnamese, european, english, english, english, english, chinese, chinese, english, english, english, hispanic, english, english, english, other, english, english, chinese, chinese, chinese, chinese, chinese, chinese, chinese, chinese, chinese, chinese, english, hispanic, japanese, japanese, korean, russian, vietnamese, vietnamese, japanese, korean, korean, vietnamese, chinese, chinese, chinese, chinese, chinese, chinese, chinese, chinese, chinese, chinese, english, hispanic, japanese, japanese, korean, russian, vietnamese, vietnamese, english, english, english, hispanic, english, english, english, european, other, english, chinese, vietnamese, vietnamese, vietnamese, chinese, chinese, chinese, chinese, chinese, chinese, chinese, japanese, russian, vietnamese, vietnamese, english, hispanic, english, english, european, english, chinese, chinese, chinese, chinese, chinese, chinese, chinese, chinese, chinese, chinese, english, hispanic, japanese, japanese, korean, russian, vietnamese, vietnamese, english, english, english, japanese, english, english, vietnamese, vietnamese, vietnamese, english, hispanic, english, english, english, other, english, chinese, korean, korean, korean, japanese, english, chinese, chinese, indian, english, hispanic, hispanic, english, european, other, chinese, chinese, japanese, korean, english, european, english, english, chinese, chinese, chinese, chinese, chinese, chinese, chinese, chinese, chinese, chinese, english, hispanic, japanese, japanese, korean, russian, vietnamese, vietnamese, other, european, indian, english, indian, korean, korean, english, english, english, english, english, european, japanese, other, english, english, english, chinese, chinese, european, european, english, english, english, english, english, japanese, japanese, chinese, vietnamese, vietnamese, vietnamese, english, english, european, hispanic, indian, other, english, russian, english, chinese, chinese, chinese, chinese, japanese, korean, vietnamese, english, english, english, english, english, english, hispanic, indian, english, other, english, english, indian, japanese, european, english, english, indian, hispanic, vietnamese, english, english, english, english, english, english, chinese, chinese, chinese, chinese, english, korean, korean, english, indian, english, english, chinese, chinese, european, european, chinese, chinese, chinese, chinese, chinese, chinese, chinese, chinese, chinese, chinese, english, hispanic, japanese, japanese, korean, russian, vietnamese, vietnamese, english, english, english, other, chinese, chinese, chinese, japanese, english, english, english, english, english, english, english, hispanic, vietnamese, hispanic, english, english, english, english, english, english, other, english, english, english, english, indian, other, english, english","US, US, US, US, US, US, US, US, US, MY, US, US, US, US, US, US, US, US, US, US, JP, US, US, US, US, US, US, US, US, US, US, US, US, US, HK, US, US, US, US, US, US, US, US, SG, FR, US, US, US, IL, US, IL, US, US, US, US, US, US, US, US, US, US, US, US, US, US, US, MY, US, IN, US, US, US, US, FR, US, US, US, US, US, US, US, US, GB, US, US, FR, US, US, US, US, US, US, US, US, US, US, US, US, US, US, US, DE, US, US, US, US, US, US, US, US, FR, US, HK, US, US, US, SG, US, US, US, MY, US, US, US, US, US, IN, US, US, US, IL, US, US, US, US, US, US, US, MY, US, US, FR, US, US, US, HK, US, US, US, US, US, US, US, US, US, US, US, US, US, US, MY, US, US, US, US, US, US, US, US, US, US, US, US, US, US, US, HK, FR, US, US, US, GB, US, US, US, US, US, US, US, US, US, US, FR, US, US, US, US, US, US, US, US, US, US, US, US, US, US, US, US, US, US, US, US, US, US, JP, US, US, US, CA, US, IN, US, US, FR, US, US, US, IL, US, US, US, US, DE, US, US, US, US, US, US, US, US, US, CH, US, GB, IL, US, US, FR, US, US, US, US, US, US, US, unknown, US, US, US, US, US, MY, US, US, US, US, US, US, US, US, US, US, JP, US, US, US, US, US, US, US, US, US, US, HK, US, US, US, US, US, US, US, US, SG, US, US, IL, US, IL, US, US, US, US, US, US, US, US, US, US, US, US, US, US, US, US, IN, US, US, US, US, US, US, US, US, US, US, US, US, US, US, US, US, US, US, US, US, US, US, HK, US, US, US, US, US, US, US, US, US, US, US, US, US, US, US, US, FR, HK, US, US, US, US, SG, DE, US, IN, US, US, US, IL, US, US, US, US, US, US, US, MY, US, US, US, US, US, FR, US, US, US, US, US, HK, US, US, US, CN, US, US, US, US, US, US, FR, US, US, US, US, IL, US, US, US, US, US, US, US, FR, US, US, US, HK, FR, US, US, US, US, US, HK, US, US, US, US, US, US, US, US, US, US, US, US, US, US, US, US, US, US, US, US, US, US, US, US, US, US, US, US, US, US, US, JP, US, US, US, IN, US, FR, US, US, US, IL, CN, US, US, US, US, US, US, US, US, US, FR, IL, US, US, FR, US, US, US, US, US, US, US, US, US, US, US, US, CH, US, IN, US, US, US, US, IL, US, IL, US, US, US, US, MY, US, US, US, US, US, US, US, FR, US, US, US, US, US, CN, US, DE, US, US, FR, US, US, US, US, MY, US, US, US, US, US, US, US, IL, US, US, MY, US, US, US, US, US, US, US, US, US, CH, IL, US, US, US, US, US, US, US, FR, US, US, US, US, US, US, FR, US, US, US, US, US, IL, US, US, JP, US, US, IN, US, US, FR, IL, CN, US, BE, US, US, US, IL, US, US, US, US, US, US, GB, US, IL, US, US, US, US, US, US, US, US, US, FR, MY, US, US, DE, US, US, IL, US, US, US, US, US, US, US, US, US, US, US, IL, US, US, US, US, DE, US, US, US, US, FR, US, US, US, US, US, US, US, US, US, US, US, US, IL, US, US, US, US, US, US, US, US, US, US, US, US, US, US, US, IL, US, US, US, IL, US, US",0.796580651491,0.28810265747
FSLR,"english, english, english, english, english, english, english, english, english, english, english, korean, chinese, chinese, korean, vietnamese, vietnamese, english, english, english, english, english, english, european, english, english, english, english, korean, english, english, english, english, english, indian, russian","US, US, US, US, US, US, US, US, US, US, US, unknown, US, US, US, US, US, US, US, US, US, US, US, US, US, US, US, US, US, US",0.501543209877,0.126666666667
IDTI,"english, indian, indian, korean, english, english, english, english, english, english, chinese, korean, korean, korean, english, english, chinese, chinese, chinese, japanese, chinese, chinese, korean, chinese, chinese, chinese, chinese, chinese, japanese, korean, korean, korean, korean, korean, chinese, chinese, chinese, chinese, chinese, chinese, chinese, chinese, chinese, chinese, english, hispanic, japanese, japanese, korean, russian, vietnamese, vietnamese, chinese, vietnamese, chinese, chinese, chinese, chinese, chinese, chinese, chinese, chinese, chinese, chinese, english, hispanic, japanese, japanese, korean, russian, vietnamese, vietnamese, english, chinese, chinese, chinese, chinese, chinese, japanese, korean, korean, korean, korean, korean, japanese, chinese, chinese, chinese, chinese, chinese, chinese, chinese, chinese, english, indian, korean, korean, korean, korean, korean, korean, indian, chinese, indian, japanese, vietnamese, vietnamese, vietnamese, vietnamese, vietnamese, vietnamese, vietnamese, vietnamese, korean, english, japanese, japanese, chinese, chinese, chinese, indian, japanese, vietnamese, vietnamese, vietnamese, vietnamese, vietnamese, vietnamese, vietnamese, vietnamese, english, japanese, chinese, chinese, chinese, chinese, chinese, chinese, chinese, chinese, chinese, chinese, english, hispanic, japanese, japanese, korean, russian, vietnamese, vietnamese, english, english, english, english, english, chinese, hispanic, korean, korean, english, english, chinese, chinese, chinese, chinese, chinese, chinese, chinese, chinese, chinese, chinese, english, hispanic, japanese, japanese, korean, russian, vietnamese, vietnamese, english, english, english, english, indian, chinese, vietnamese, chinese, indian, japanese, vietnamese, vietnamese, vietnamese, vietnamese, vietnamese, vietnamese, vietnamese, vietnamese, english, english, chinese, chinese, european, european, chinese, chinese, chinese, chinese, chinese, japanese, korean, korean, korean, korean, korean, vietnamese, english, english, english, english, european, chinese, chinese, chinese, chinese, chinese, chinese, chinese, chinese, english, indian, korean, korean, korean, korean, korean, korean, english, european, chinese, vietnamese, vietnamese, vietnamese, english, chinese, chinese, chinese, chinese, vietnamese, vietnamese, chinese, chinese, chinese, chinese, japanese, korean, korean, korean, korean, english, european, european, english, chinese, chinese, japanese, korean, english, korean, korean, korean, korean, russian, chinese, vietnamese, vietnamese, vietnamese, english, english, european, european, english, chinese, chinese, european, european, english, vietnamese, english, chinese, korean, korean, korean, vietnamese, english, european, japanese, korean, korean, vietnamese, korean, english, indian, indian, korean, chinese, chinese, chinese, chinese, chinese, chinese, chinese, chinese, english, indian, korean, korean, korean, korean, korean, korean, russian, vietnamese, english, hispanic, english, english, chinese, vietnamese, chinese, chinese, chinese, chinese, chinese, chinese, chinese, chinese, english, indian, korean, korean, korean, korean, korean, korean, english, chinese, chinese, chinese, chinese, japanese, korean, korean, korean, korean, chinese, chinese, chinese, chinese, chinese, chinese, chinese, chinese, english, indian, korean, korean, korean, korean, korean, korean, english, english, chinese, vietnamese, english, english, english, european, european, english, chinese, chinese, chinese, japanese, english, english, english, english, chinese, chinese, chinese, chinese, chinese, chinese, chinese, japanese, russian, vietnamese, vietnamese, chinese, chinese, chinese, chinese, chinese, chinese, chinese, chinese, chinese, chinese, english, hispanic, japanese, japanese, korean, russian, vietnamese, vietnamese, vietnamese, chinese, chinese, chinese, chinese, chinese, chinese, chinese, chinese, chinese, chinese, english, hispanic, japanese, japanese, korean, russian, vietnamese, vietnamese, english, english, chinese, chinese, chinese, chinese, chinese, chinese, korean, korean, korean, korean, vietnamese, vietnamese, chinese, chinese, chinese, chinese, chinese, chinese, chinese, chinese, english, indian, korean, korean, korean, korean, korean, korean, japanese, english, english, chinese, chinese, chinese, chinese, chinese, japanese, korean, korean, korean, korean, korean, chinese, chinese, japanese, korean, chinese, chinese, chinese, chinese, vietnamese, vietnamese, chinese, vietnamese, vietnamese, vietnamese, english, indian, indian, indian, english, english, english, chinese, chinese, chinese, chinese, chinese, chinese, chinese, chinese, english, indian, korean, korean, korean, korean, korean, korean, english, chinese, chinese, chinese, chinese, chinese, japanese, korean, korean, korean, korean, korean, english, chinese, korean, korean, korean, vietnamese, chinese, chinese, chinese, chinese, english, korean, korean, english, english, chinese, chinese, japanese, korean, english, english, chinese, chinese, chinese, chinese, chinese, hispanic, korean, korean, korean, korean, english, chinese, chinese, chinese, chinese, chinese, chinese, chinese, chinese, korean, korean, korean, korean, vietnamese, vietnamese, hispanic, hispanic, chinese, chinese, chinese, japanese, korean, english, chinese, chinese, chinese, chinese, chinese, chinese, chinese, chinese, chinese, chinese, english, hispanic, japanese, japanese, korean, russian, vietnamese, vietnamese, chinese, chinese, chinese, chinese, chinese, chinese, korean, korean, korean, korean, vietnamese, vietnamese, english, english, english, chinese, chinese, chinese, english, vietnamese, chinese, chinese, chinese, chinese, chinese, japanese, korean, korean, korean, korean, korean, chinese, chinese, chinese, chinese, chinese, hispanic, korean, korean, korean, korean, chinese, chinese, chinese, chinese, chinese, chinese, chinese, chinese, chinese, chinese, english, indian, korean, korean, korean, korean, korean, korean, chinese, english, chinese, chinese, chinese, korean, korean, korean, korean, chinese, chinese, chinese, chinese, chinese, chinese, chinese, chinese, english, indian, korean, korean, korean, korean, korean, korean, korean, korean, korean, korean, russian","US, US, US, US, US, US, US, US, US, US, AU, US, US, US, US, US, US, US, US, US, US, US, US, US, US, US, AU, US, US, US, US, US, US, US, US, US, US, MY, US, US, US, US, US, AU, US, US, US, US, US, US, US, US, US, US, US, US, US, US, US, US, US, US, US, US, US, US, US, US, US, US, TW, US, US, US, US, US, unknown, US, US, US, US, US, US, US, US, US, US, US, US, US, US, US, US, US, US, US, US, US, US, AU, US, US, US, US, US, US, US, US, US, MY, US, US, US, US, US, US, US, US, US, US, US, US, US, US, US, US, US, US, US, US, US, US, US, US, US, US, US, US, US, US, US, US, US, US, US, US, US, US, US, US, US, US, US, US, US",0.757403906742,0.111800208117
